{
    "schema":  "athena.repository_context_capsule.v1",
    "generated_at":  "2026-08-02T00:04:54.4138260+10:00",
    "project":  {
                    "name":  "Project Athena",
                    "root":  "D:\\Projects\\Project Athena",
                    "repository":  "IAMACESIRX/Project-Athena"
                },
    "profile":  "bounded",
    "git":  {
                "commit":  "9713c74cbaaecc553094e5ae1f32b43dde72236a",
                "branch":  "main",
                "dirty":  true,
                "status":  [
                               "M .gitattributes",
                               " M AI-PORTAL.md",
                               " M Plan/FEATURE_ROADMAP.md",
                               " M Plan/IMPLEMENTATION_MATRIX.md",
                               " M Plan/OASIS_ATHENA_AGENT_MODEL.md",
                               " M Plan/ROADMAP.md",
                               " M Plan/TODO.md",
                               " M Plan/TODO_STATUS.md",
                               " M Plan/context.md",
                               " M README.md",
                               " M START-HERE.md",
                               " M agents/agent-registry.yml",
                               " M athena_context/README.md",
                               " M cognition/contextual-anchoring/anchor-registry.yml",
                               " M cognition/non-monotonic-reasoning/revision-ledger.yml",
                               " M context-file-index.md",
                               " M context.md",
                               " M diagnostics/correction-queue.md",
                               " M diagnostics/reports/latest-integrity-report.json",
                               " M diagnostics/reports/latest-integrity-report.md",
                               " M engine/cycle-history.csv",
                               " M engine/cycle-reports/latest-cycle-report.json",
                               " M engine/cycle-reports/latest-cycle-report.md",
                               " M engine/operation-cycle.md",
                               " M engine/order-of-operations.md",
                               " M forensics/verification-reports/latest-forensic-verification.json",
                               " M forensics/verification-reports/latest-forensic-verification.md",
                               " M governance/absolutes.md",
                               " M handoff/CURRENT_STATE.md",
                               " M integration/adapter-contract.md",
                               " M manifests/capability-matrix.yml",
                               " M manifests/generated-ai-index.json",
                               " M manifests/ingestion-order.yml",
                               " M manifests/system-manifest.json",
                               " M memory/athena-memory-map.md",
                               " M memory/project-memory.md",
                               " M navigation/generated/project-map.json",
                               " M observability/reports/latest-log-intelligence.json",
                               " M observability/reports/latest-log-intelligence.md",
                               " M projects/project-registry.yml",
                               " M sensory/baselines/watched-state-baseline.csv",
                               " M sensory/scans/SCAN-LOG.md",
                               " M sensory/scans/latest-scan.json",
                               " M sensory/scans/latest-watched-changes.json",
                               " M sensory/scans/latest-watched-changes.md",
                               " M tools/Export-AISystemManifest.ps1",
                               " M tools/Invoke-AIIntegrityCheck.ps1",
                               " M tools/README.md",
                               " M tools/Update-ContextFileIndex.ps1",
                               " M work/ATHENA-FIRST-STEPS.md",
                               " M work/README.md",
                               " M work/TODO.md",
                               " M work/backlog.yml",
                               " M work/bugs.yml",
                               " M work/decisions-needed.md",
                               " M work/features.yml",
                               " M work/milestones.md",
                               "?? .github/",
                               "?? .gitignore",
                               "?? Plan/ATHENA_DISTRIBUTED_COGNITIVE_FABRIC.md",
                               "?? Plan/CHAT_DERIVED_CONCEPT_REGISTER.md",
                               "?? Plan/CHAT_REPOSITORY_CONTINUITY_PIPELINE.md",
                               "?? Plan/LIGHTCORE_PHYSICAL_EXECUTION_PROFILE.md",
                               "?? Plan/OASIS_REALITY_COMPILER.md",
                               "?? Plan/OPERATIVE_DUPLEX_AI_MODEL.md",
                               "?? agents/adapters/",
                               "?? athena_context/ASSET_INVENTORY.md",
                               "?? athena_context/RECONCILIATION.md",
                               "?? athena_context/assets/",
                               "?? athena_context/reconciliation.json",
                               "?? continuity/chat-repository-sync/",
                               "?? engine/cycle-reports/ATHENA-CHAT-RECONCILIATION-CYCLE-20260801-004.md",
                               "?? engine/cycle-reports/ATHENA-CHAT-REPOSITORY-SYNC-CYCLE-20260801-005.md",
                               "?? projects/project-athena/",
                               "?? schemas/athena-adapter.schema.json",
                               "?? schemas/chat-promotion.schema.json",
                               "?? schemas/chat-source-bundle.schema.json",
                               "?? schemas/operative-action.schema.json",
                               "?? schemas/project-capsule.schema.json",
                               "?? schemas/repository-context-capsule.schema.json",
                               "?? tools/Export-AthenaChatContext.ps1",
                               "?? tools/Import-AthenaChatExport.ps1",
                               "?? tools/Sync-AthenaGitHub.ps1",
                               "?? tools/Test-AthenaAssetManifest.ps1",
                               "?? tools/Test-AthenaRepository.ps1",
                               "?? work/github-plan.json",
                               "?? work/intake/ATHENA-INTAKE-20260801-004-chat-reconciliation.md",
                               "?? work/intake/ATHENA-INTAKE-20260801-005-two-way-chat-repository-and-github.md"
                           ]
            },
    "files":  [
                  {
                      "path":  "AI-PORTAL.md",
                      "sha256":  "9522b16cd80fd6a46974b5be4cd00e0cfbfbe3c637a20331248fc4184f4abae4",
                      "bytes":  5868,
                      "characters":  5865,
                      "included_characters":  5865,
                      "truncated":  false
                  },
                  {
                      "path":  "START-HERE.md",
                      "sha256":  "ed92ba8a8d0a98f6f3aaff812d9eb37cdbcd833ce1c4e1fe8f5918ad6cb1f6c3",
                      "bytes":  3047,
                      "characters":  3047,
                      "included_characters":  3047,
                      "truncated":  false
                  },
                  {
                      "path":  "context.md",
                      "sha256":  "9f6a36a1443adfae83daf6acf1c51266a545e7822ab4d92ce97aad975681b597",
                      "bytes":  55977,
                      "characters":  55977,
                      "included_characters":  24000,
                      "truncated":  true
                  },
                  {
                      "path":  "Plan/context.md",
                      "sha256":  "06b7990d812822388e1740111b7d2ae17837f93164e65f2e464e1401ce306e56",
                      "bytes":  26788,
                      "characters":  26788,
                      "included_characters":  24000,
                      "truncated":  true
                  },
                  {
                      "path":  "Plan/CHAT_REPOSITORY_CONTINUITY_PIPELINE.md",
                      "sha256":  "258271b26836957f36ada186dc2cb4d30a30992a2f60e99a4fb0e2b154073750",
                      "bytes":  5400,
                      "characters":  5400,
                      "included_characters":  5400,
                      "truncated":  false
                  },
                  {
                      "path":  "Plan/CHAT_DERIVED_CONCEPT_REGISTER.md",
                      "sha256":  "22e049cbfde41a00cd44a4cd80dfcaafee7fba9adadb6b14425d7db171ff767c",
                      "bytes":  14372,
                      "characters":  14372,
                      "included_characters":  14372,
                      "truncated":  false
                  },
                  {
                      "path":  "Plan/IMPLEMENTATION_MATRIX.md",
                      "sha256":  "b27bd2587e80ae6956879042d03d36b2e37233dacc5fd73ffc633cfcbed700c1",
                      "bytes":  7336,
                      "characters":  7336,
                      "included_characters":  7336,
                      "truncated":  false
                  },
                  {
                      "path":  "Plan/ROADMAP.md",
                      "sha256":  "3f02739c3e0d6d75562da1630ecd32b9d741695dcce158070502b84c2c901900",
                      "bytes":  5298,
                      "characters":  5298,
                      "included_characters":  5298,
                      "truncated":  false
                  },
                  {
                      "path":  "memory/athena-memory-map.md",
                      "sha256":  "3e350b0c993ac09cc4fb9c1bb01649a731e0cfea639c3311484ed1bea52ec4d0",
                      "bytes":  5491,
                      "characters":  5491,